{
  "alias_history": [
    {
      "alias": "candidate",
      "moved_at": "2026-07-10T01:48:06Z",
      "previous": null,
      "reason": "stage public fixture candidate",
      "target": "local/mock-candidate"
    },
    {
      "alias": "rollback",
      "moved_at": "2026-07-10T01:48:06Z",
      "previous": null,
      "reason": "establish pre-promotion public fixture aliases",
      "target": "local/mock-rollback"
    },
    {
      "alias": "champion",
      "moved_at": "2026-07-10T01:48:06Z",
      "previous": null,
      "reason": "establish pre-promotion public fixture aliases",
      "target": "local/mock-baseline"
    },
    {
      "previous_aliases": {
        "candidate": "local/mock-candidate",
        "champion": "local/mock-baseline",
        "rollback": "local/mock-rollback"
      },
      "promotion_decision_sha256": "aedbec6d0ec618ef49e0d3399e9219cb7ed28dbf2308bdf63522f9718341ae68",
      "updated_aliases": {
        "candidate": "local/mock-candidate",
        "champion": "local/mock-candidate",
        "rollback": "local/mock-baseline"
      }
    }
  ],
  "aliases": {
    "candidate": "local/mock-candidate",
    "champion": "local/mock-candidate",
    "rollback": "local/mock-baseline"
  },
  "entries": {
    "local/mock-baseline": {
      "candidate": {
        "candidate_id": "local/mock-baseline",
        "compatibility": {
          "chat_template": {
            "notes": "Synthetic fixture metadata only.",
            "status": "metadata_only",
            "verified": false
          },
          "context_length": 2048,
          "memory": {
            "notes": "Synthetic fixture metadata only.",
            "status": "metadata_only",
            "verified": false
          },
          "quantization": {
            "notes": "Synthetic fixture metadata only.",
            "status": "metadata_only",
            "verified": false
          },
          "serving": {
            "notes": "Synthetic fixture metadata only.",
            "status": "metadata_only",
            "verified": false
          },
          "structured_outputs": {
            "notes": "Synthetic fixture metadata only.",
            "status": "metadata_only",
            "supported": true,
            "verified": false
          },
          "tokenizer": {
            "notes": "Synthetic fixture metadata only.",
            "status": "metadata_only",
            "verified": false
          },
          "tool_calls": {
            "notes": "Synthetic fixture metadata only.",
            "status": "metadata_only",
            "supported": true,
            "verified": false
          }
        },
        "license": {
          "accepted_terms": true,
          "license_id": "synthetic-local-fixture",
          "notes": [
            "No model weights are distributed by this trace-only fixture."
          ],
          "review_status": "approved",
          "reviewed_at": "2026-07-03T00:00:00Z",
          "reviewer": "public-fixture-review",
          "source_url": "https://spdx.org/licenses/MIT.html",
          "status": "known",
          "terms_url": "https://spdx.org/licenses/MIT.html",
          "training_allowed": false
        },
        "model_id": "local/mock-baseline",
        "notes": [
          "Trace-only current champion for the closed-loop public fixture; no weights are downloaded."
        ],
        "schema_version": "hfr.model_candidate.v1",
        "source": {
          "revision": "public-fixture-v1",
          "type": "local_fixture",
          "url": "file://examples/agentic_training/serving_lifecycle/managed_mock/preflight/serving_profile.json",
          "weight_download_allowed": false
        }
      },
      "candidate_id": "local/mock-baseline",
      "entry_id": "local/mock-baseline",
      "license_status": "known",
      "links": {
        "adapters": [],
        "datasets": [],
        "evals": [],
        "promotion_decisions": [],
        "serving_probes": [],
        "training_runs": []
      },
      "notes": [],
      "registered_at": "2026-07-10T01:48:05Z",
      "schema_version": "hfr.model_registry_entry.v1",
      "status": "current_champion",
      "training_eligible": false,
      "updated_at": "2026-07-10T01:48:05Z"
    },
    "local/mock-candidate": {
      "candidate": {
        "candidate_id": "local/mock-candidate",
        "compatibility": {
          "chat_template": {
            "notes": "Synthetic fixture metadata only.",
            "status": "metadata_only",
            "verified": false
          },
          "context_length": 2048,
          "memory": {
            "notes": "Synthetic fixture metadata only.",
            "status": "metadata_only",
            "verified": false
          },
          "quantization": {
            "notes": "Synthetic fixture metadata only.",
            "status": "metadata_only",
            "verified": false
          },
          "serving": {
            "notes": "Synthetic fixture metadata only.",
            "status": "metadata_only",
            "verified": false
          },
          "structured_outputs": {
            "notes": "Synthetic fixture metadata only.",
            "status": "metadata_only",
            "supported": true,
            "verified": false
          },
          "tokenizer": {
            "notes": "Synthetic fixture metadata only.",
            "status": "metadata_only",
            "verified": false
          },
          "tool_calls": {
            "notes": "Synthetic fixture metadata only.",
            "status": "metadata_only",
            "supported": true,
            "verified": false
          }
        },
        "license": {
          "accepted_terms": true,
          "license_id": "synthetic-local-fixture",
          "notes": [
            "No model weights are distributed by this trace-only fixture."
          ],
          "review_status": "approved",
          "reviewed_at": "2026-07-03T00:00:00Z",
          "reviewer": "public-fixture-review",
          "source_url": "https://spdx.org/licenses/MIT.html",
          "status": "known",
          "terms_url": "https://spdx.org/licenses/MIT.html",
          "training_allowed": false
        },
        "model_id": "local/mock-candidate",
        "notes": [
          "Trace-only candidate for the closed-loop public fixture; no weights are downloaded."
        ],
        "schema_version": "hfr.model_candidate.v1",
        "source": {
          "revision": "public-fixture-v1",
          "type": "local_fixture",
          "url": "file://examples/agentic_training/promotion_result.json",
          "weight_download_allowed": false
        }
      },
      "candidate_id": "local/mock-candidate",
      "entry_id": "local/mock-candidate",
      "license_status": "known",
      "links": {
        "adapters": [],
        "datasets": [
          {
            "id": "agentic-training-export",
            "kind": "training_export_manifest",
            "metadata": {},
            "path": "examples/agentic_training/training_export/manifest.json",
            "recorded_at": "2026-07-10T01:48:06Z",
            "sha256": "f68a6fa6e13bcd287ad4ea4afa9b7ac3417537bb45950faa7774ec437e1336de",
            "size_bytes": 22973,
            "status": "ready"
          }
        ],
        "evals": [
          {
            "id": "heldout-compare-gate",
            "kind": "compare_gate",
            "metadata": {},
            "path": "examples/agentic_training/promotion_governance/compare_gate.json",
            "recorded_at": "2026-07-10T01:48:06Z",
            "sha256": "26210e3a60354af9caaf8340eadcd2cca4779c217c2db75e9e198ca1225491e3",
            "size_bytes": 16328,
            "status": "ready"
          }
        ],
        "promotion_decisions": [],
        "serving_probes": [
          {
            "id": "managed-mock-serving",
            "kind": "serving_check",
            "metadata": {},
            "path": "examples/agentic_training/serving_lifecycle/managed_mock/preflight/serving_check.json",
            "recorded_at": "2026-07-10T01:48:06Z",
            "sha256": "767c7e9d96f91f003b2eef0f3b1249e18857dca18f7849471e18537085716e06",
            "size_bytes": 4632,
            "status": "ready"
          }
        ],
        "training_runs": [
          {
            "id": "demo-loop-001-training",
            "kind": "agentic_training_result",
            "metadata": {},
            "path": "examples/agentic_training/promotion_result.json",
            "recorded_at": "2026-07-10T01:48:06Z",
            "sha256": "0f30e86b2925e7cc8d597c4b1e2c72822fe9c0c30fc721aca0b5436ffc68fd5e",
            "size_bytes": 11571,
            "status": "completed"
          }
        ]
      },
      "notes": [],
      "registered_at": "2026-07-10T01:48:05Z",
      "schema_version": "hfr.model_registry_entry.v1",
      "status": "promotion_candidate",
      "training_eligible": false,
      "updated_at": "2026-07-10T01:48:06Z"
    },
    "local/mock-rollback": {
      "candidate": {
        "candidate_id": "local/mock-rollback",
        "compatibility": {
          "chat_template": {
            "notes": "Synthetic fixture metadata only.",
            "status": "metadata_only",
            "verified": false
          },
          "context_length": 2048,
          "memory": {
            "notes": "Synthetic fixture metadata only.",
            "status": "metadata_only",
            "verified": false
          },
          "quantization": {
            "notes": "Synthetic fixture metadata only.",
            "status": "metadata_only",
            "verified": false
          },
          "serving": {
            "notes": "Synthetic fixture metadata only.",
            "status": "metadata_only",
            "verified": false
          },
          "structured_outputs": {
            "notes": "Synthetic fixture metadata only.",
            "status": "metadata_only",
            "supported": true,
            "verified": false
          },
          "tokenizer": {